{
  "$schema": "http://json-schema.org/draft-07/schema#",
  "title": "TGPetFile",
  "description": "AI Instruction: This schema defines the structure for a Tokengotchi Pet (.json). You must generate a strictly valid JSON file conforming to this structure.",
  "type": "object",
  "required": ["name", "dock", "menuBar"],
  "properties": {
    "name": {
      "type": "string",
      "description": "AI: The identity or name of the pet. Keep it short and thematic."
    },
    "palette": {
      "type": "object",
      "description": "AI: Optional palette for colors used in SVGs via var(--key). E.g. 'base', 'accent', 'glow'. Include this so SVGs can share variables.",
      "additionalProperties": {
        "type": "string",
        "pattern": "^#([A-Fa-f0-9]{6}|[A-Fa-f0-9]{3})$",
        "description": "AI: Must be a valid hex color code (e.g. #FF0000)."
      }
    },
    "menuBar": {
      "allOf": [
        { "$ref": "#/definitions/TGPetContext" }
      ],
      "description": "AI: The context for the Mac menu bar. All SVGs should ideally use viewBox='0 0 100 100'. IMPORTANT: The menuBar is scaled down drastically to a 22x22 system icon. Keep all shapes and movements centered and animations extremely subtle so they remain legible at tiny sizes."
    },
    "dock": {
      "allOf": [
        { "$ref": "#/definitions/TGPetContext" }
      ],
      "description": "AI: The context for the main desktop/dock renderer. All SVGs should ideally use viewBox='0 0 100 100'. This renders into a larger 128x128 canvas, meaning animations can be much more expressive and take up a larger area."
    }
  },
  "additionalProperties": false,
  "definitions": {
    "TGPetContext": {
      "type": "object",
      "required": ["svgs", "states"],
      "properties": {
        "svgs": {
          "type": "array",
          "description": "AI: Array of SVG objects used in this context. Usually contains a 'base_svg' with groups that are targeted by animations.",
          "items": { "$ref": "#/definitions/TGSVGObject" },
          "minItems": 1
        },
        "states": {
          "type": "array",
          "description": "AI: Array of top-level states (PetMode). Must cover at least 'idle'. Valid IDs are: idle, busy, waiting, completed, error.",
          "items": { "$ref": "#/definitions/TGState" },
          "minItems": 1
        }
      },
      "additionalProperties": false
    },
    "TGSVGObject": {
      "type": "object",
      "required": ["id"],
      "properties": {
        "id": {
          "type": "string",
          "description": "AI: Unique identifier for this SVG. E.g., 'base_svg' or 'surprise_face'."
        },
        "svg": {
          "type": "string",
          "description": "AI: The actual raw SVG string. Omit this if you are just referencing an existing SVG id. CRITICAL SVG RULES: 1) ALWAYS use inline presentation attributes (e.g. fill='var(--base)') instead of CSS classes. 2) BANNED ELEMENTS: <style>, <text>, <animate>, <use>, <image>. 3) Arcs ('A') are linearly approximated; prefer cubic beziers ('C') for smooth curves. 4) Use viewBox='0 0 100 100'. 5) Add id attributes to <g> tags so they can be animated via KeyframeTracks."
        }
      },
      "additionalProperties": false
    },
    "TGState": {
      "type": "object",
      "required": ["id", "animations"],
      "properties": {
        "id": {
          "type": "string",
          "description": "AI: For top-level states, must be one of: idle, busy, waiting, completed, error. For substates under 'busy', must be one of: reading, thinking, writing, searching, planning, building, running.",
          "enum": ["idle", "busy", "waiting", "completed", "error", "reading", "thinking", "writing", "searching", "planning", "building", "running"]
        },
        "animations": {
          "type": "array",
          "description": "AI: List of animation variants for this state.",
          "items": { "$ref": "#/definitions/TGAnimationDef" },
          "minItems": 1
        },
        "subStates": {
          "type": "array",
          "description": "AI: Optional substates. Usually used when the top-level state is 'busy' to define specific tool phase animations.",
          "items": { "$ref": "#/definitions/TGState" }
        }
      },
      "additionalProperties": false
    },
    "TGAnimationDef": {
      "type": "object",
      "required": ["id", "name", "description", "duration"],
      "properties": {
        "id": {
          "type": "string",
          "description": "AI: Unique ID for this animation clip (e.g. 'idle_breathe')."
        },
        "name": {
          "type": "string",
          "description": "AI: Human-readable name for the animation."
        },
        "description": {
          "type": "string",
          "description": "AI: Detailed description of what the animation looks like."
        },
        "duration": {
          "type": "number",
          "minimum": 0.1,
          "description": "AI: Duration of the animation loop in seconds."
        },
        "svg": {
          "description": "AI: Optional override SVG object to use instead of the context's default. Can ONLY be used if 'tracks' are used, NOT with 'frames'.",
          "$ref": "#/definitions/TGSVGObject"
        },
        "tracks": {
          "type": "array",
          "description": "AI: Keyframe tracks for animating SVG parts via CSS transforms (rotate, translate, scale) and colors (fill, stroke). Mutually exclusive with 'frames'. Provide either tracks OR frames.",
          "items": { "$ref": "#/definitions/KeyframeTrack" }
        },
        "frames": {
          "type": "array",
          "description": "AI: Array of full SVG strings for frame-by-frame animation. Mutually exclusive with 'tracks'.",
          "items": { "type": "string" }
        }
      },
      "additionalProperties": false
    },
    "KeyframeTrack": {
      "type": "object",
      "required": ["targetId", "keyframes"],
      "properties": {
        "targetId": {
          "type": "string",
          "description": "AI: The DOM ID of the SVG element/group to animate (e.g. 'left_ear')."
        },
        "keyframes": {
          "type": "array",
          "description": "AI: The keyframes for this track.",
          "items": { "$ref": "#/definitions/Keyframe" },
          "minItems": 2
        }
      },
      "additionalProperties": false
    },
    "Keyframe": {
      "type": "object",
      "required": ["time"],
      "properties": {
        "time": {
          "type": "number",
          "minimum": 0,
          "description": "AI: The time in seconds when this keyframe occurs."
        },
        "rotate": {
          "type": "number",
          "description": "AI: Rotation angle in degrees."
        },
        "tx": {
          "type": "number",
          "description": "AI: X-axis translation."
        },
        "ty": {
          "type": "number",
          "description": "AI: Y-axis translation."
        },
        "sx": {
          "type": "number",
          "description": "AI: X-axis scale multiplier (1.0 is default)."
        },
        "sy": {
          "type": "number",
          "description": "AI: Y-axis scale multiplier (1.0 is default)."
        },
        "fill": {
          "type": "string",
          "description": "AI: Optional. Override the fill color (hex or var(--key))."
        },
        "stroke": {
          "type": "string",
          "description": "AI: Optional. Override the stroke color (hex or var(--key))."
        }
      },
      "additionalProperties": false
    }
  }
}
