{
  "menuBar": {
    "svgs": [
      {
        "id": "menu_base",
        "svg": "<svg xmlns=\"http://www.w3.org/2000/svg\" viewBox=\"0 0 100 100\"><g id=\"menu_kuramon\"><path d=\"M 50 15 C 75 15 85 35 85 55 C 85 75 70 85 50 85 C 30 85 15 75 15 55 C 15 35 25 15 50 15 Z M 50 40 C 40 40 35 48 35 55 C 35 62 40 70 50 70 C 60 70 65 62 65 55 C 65 48 60 40 50 40 Z\" fill=\"#000000\" fill-rule=\"evenodd\"/><path d=\"M 20 20 C 25 35 30 35 30 35 C 30 35 25 15 35 25 C 25 15 15 5 20 20 Z M 80 20 C 85 5 75 15 65 25 C 75 15 70 35 70 35 C 70 35 75 35 80 20 Z M 25 90 C 35 85 40 78 40 75 C 40 75 25 80 30 75 C 20 85 10 95 25 90 Z M 75 90 C 90 95 80 85 70 75 C 75 80 60 75 60 75 C 60 78 65 85 75 90 Z\" fill=\"#000000\"/></g></svg>"
      }
    ],
    "states": [
      {
        "id": "idle",
        "animations": [
          {
            "id": "menu_idle",
            "name": "Soft Blink Dot",
            "description": "The tiny template icon holds still while the negative-space eye softly closes to a narrow slit and opens again.",
            "duration": 2,
            "frames": [
              "<svg xmlns=\"http://www.w3.org/2000/svg\" viewBox=\"0 0 100 100\"><g id=\"menu_kuramon\"><path d=\"M 50 15 C 75 15 85 35 85 55 C 85 75 70 85 50 85 C 30 85 15 75 15 55 C 15 35 25 15 50 15 Z M 50 40 C 58.284271247 40 65 46.715728753 65 55 C 65 63.284271247 58.284271247 70 50 70 C 41.715728753 70 35 63.284271247 35 55 C 35 46.715728753 41.715728753 40 50 40 Z\" fill=\"#000000\" fill-rule=\"evenodd\"/><path d=\"M 20 20 C 25 35 30 35 30 35 C 30 35 25 15 35 25 C 25 15 15 5 20 20 Z M 80 20 C 85 5 75 15 65 25 C 75 15 70 35 70 35 C 70 35 75 35 80 20 Z M 25 90 C 35 85 40 78 40 75 C 40 75 25 80 30 75 C 20 85 10 95 25 90 Z M 75 90 C 90 95 80 85 70 75 C 75 80 60 75 60 75 C 60 78 65 85 75 90 Z\" fill=\"#000000\"/></g></svg>",
              "<svg xmlns=\"http://www.w3.org/2000/svg\" viewBox=\"0 0 100 100\"><g id=\"menu_kuramon\"><path d=\"M 50 15 C 75 15 85 35 85 55 C 85 75 70 85 50 85 C 30 85 15 75 15 55 C 15 35 25 15 50 15 Z M 50 40 C 58.284271247 40 65 46.715728753 65 55 C 65 63.284271247 58.284271247 70 50 70 C 41.715728753 70 35 63.284271247 35 55 C 35 46.715728753 41.715728753 40 50 40 Z\" fill=\"#000000\" fill-rule=\"evenodd\"/><path d=\"M 20 20 C 25 35 30 35 30 35 C 30 35 25 15 35 25 C 25 15 15 5 20 20 Z M 80 20 C 85 5 75 15 65 25 C 75 15 70 35 70 35 C 70 35 75 35 80 20 Z M 25 90 C 35 85 40 78 40 75 C 40 75 25 80 30 75 C 20 85 10 95 25 90 Z M 75 90 C 90 95 80 85 70 75 C 75 80 60 75 60 75 C 60 78 65 85 75 90 Z\" fill=\"#000000\"/></g></svg>",
              "<svg xmlns=\"http://www.w3.org/2000/svg\" viewBox=\"0 0 100 100\"><g id=\"menu_kuramon\"><path d=\"M 50 15 C 75 15 85 35 85 55 C 85 75 70 85 50 85 C 30 85 15 75 15 55 C 15 35 25 15 50 15 Z M 50 40 C 58.284271247 40 65 46.715728753 65 55 C 65 63.284271247 58.284271247 70 50 70 C 41.715728753 70 35 63.284271247 35 55 C 35 46.715728753 41.715728753 40 50 40 Z\" fill=\"#000000\" fill-rule=\"evenodd\"/><path d=\"M 20 20 C 25 35 30 35 30 35 C 30 35 25 15 35 25 C 25 15 15 5 20 20 Z M 80 20 C 85 5 75 15 65 25 C 75 15 70 35 70 35 C 70 35 75 35 80 20 Z M 25 90 C 35 85 40 78 40 75 C 40 75 25 80 30 75 C 20 85 10 95 25 90 Z M 75 90 C 90 95 80 85 70 75 C 75 80 60 75 60 75 C 60 78 65 85 75 90 Z\" fill=\"#000000\"/></g></svg>",
              "<svg xmlns=\"http://www.w3.org/2000/svg\" viewBox=\"0 0 100 100\"><g id=\"menu_kuramon\"><path d=\"M 50 15 C 75 15 85 35 85 55 C 85 75 70 85 50 85 C 30 85 15 75 15 55 C 15 35 25 15 50 15 Z M 50 40 C 58.284271247 40 65 46.715728753 65 55 C 65 63.284271247 58.284271247 70 50 70 C 41.715728753 70 35 63.284271247 35 55 C 35 46.715728753 41.715728753 40 50 40 Z\" fill=\"#000000\" fill-rule=\"evenodd\"/><path d=\"M 20 20 C 25 35 30 35 30 35 C 30 35 25 15 35 25 C 25 15 15 5 20 20 Z M 80 20 C 85 5 75 15 65 25 C 75 15 70 35 70 35 C 70 35 75 35 80 20 Z M 25 90 C 35 85 40 78 40 75 C 40 75 25 80 30 75 C 20 85 10 95 25 90 Z M 75 90 C 90 95 80 85 70 75 C 75 80 60 75 60 75 C 60 78 65 85 75 90 Z\" fill=\"#000000\"/></g></svg>",
              "<svg xmlns=\"http://www.w3.org/2000/svg\" viewBox=\"0 0 100 100\"><g id=\"menu_kuramon\"><path d=\"M 50 15 C 75 15 85 35 85 55 C 85 75 70 85 50 85 C 30 85 15 75 15 55 C 15 35 25 15 50 15 Z M 50 40 C 58.284271247 40 65 46.715728753 65 55 C 65 63.284271247 58.284271247 70 50 70 C 41.715728753 70 35 63.284271247 35 55 C 35 46.715728753 41.715728753 40 50 40 Z\" fill=\"#000000\" fill-rule=\"evenodd\"/><path d=\"M 20 20 C 25 35 30 35 30 35 C 30 35 25 15 35 25 C 25 15 15 5 20 20 Z M 80 20 C 85 5 75 15 65 25 C 75 15 70 35 70 35 C 70 35 75 35 80 20 Z M 25 90 C 35 85 40 78 40 75 C 40 75 25 80 30 75 C 20 85 10 95 25 90 Z M 75 90 C 90 95 80 85 70 75 C 75 80 60 75 60 75 C 60 78 65 85 75 90 Z\" fill=\"#000000\"/></g></svg>",
              "<svg xmlns=\"http://www.w3.org/2000/svg\" viewBox=\"0 0 100 100\"><g id=\"menu_kuramon\"><path d=\"M 50 15 C 75 15 85 35 85 55 C 85 75 70 85 50 85 C 30 85 15 75 15 55 C 15 35 25 15 50 15 Z M 50 40 C 58.284271247 40 65 46.715728753 65 55 C 65 63.284271247 58.284271247 70 50 70 C 41.715728753 70 35 63.284271247 35 55 C 35 46.715728753 41.715728753 40 50 40 Z\" fill=\"#000000\" fill-rule=\"evenodd\"/><path d=\"M 20 20 C 25 35 30 35 30 35 C 30 35 25 15 35 25 C 25 15 15 5 20 20 Z M 80 20 C 85 5 75 15 65 25 C 75 15 70 35 70 35 C 70 35 75 35 80 20 Z M 25 90 C 35 85 40 78 40 75 C 40 75 25 80 30 75 C 20 85 10 95 25 90 Z M 75 90 C 90 95 80 85 70 75 C 75 80 60 75 60 75 C 60 78 65 85 75 90 Z\" fill=\"#000000\"/></g></svg>",
              "<svg xmlns=\"http://www.w3.org/2000/svg\" viewBox=\"0 0 100 100\"><g id=\"menu_kuramon\"><path d=\"M 50 15 C 75 15 85 35 85 55 C 85 75 70 85 50 85 C 30 85 15 75 15 55 C 15 35 25 15 50 15 Z M 50 40 C 58.284271247 40 65 46.715728753 65 55 C 65 63.284271247 58.284271247 70 50 70 C 41.715728753 70 35 63.284271247 35 55 C 35 46.715728753 41.715728753 40 50 40 Z\" fill=\"#000000\" fill-rule=\"evenodd\"/><path d=\"M 20 20 C 25 35 30 35 30 35 C 30 35 25 15 35 25 C 25 15 15 5 20 20 Z M 80 20 C 85 5 75 15 65 25 C 75 15 70 35 70 35 C 70 35 75 35 80 20 Z M 25 90 C 35 85 40 78 40 75 C 40 75 25 80 30 75 C 20 85 10 95 25 90 Z M 75 90 C 90 95 80 85 70 75 C 75 80 60 75 60 75 C 60 78 65 85 75 90 Z\" fill=\"#000000\"/></g></svg>",
              "<svg xmlns=\"http://www.w3.org/2000/svg\" viewBox=\"0 0 100 100\"><g id=\"menu_kuramon\"><path d=\"M 50 15 C 75 15 85 35 85 55 C 85 75 70 85 50 85 C 30 85 15 75 15 55 C 15 35 25 15 50 15 Z M 50 40 C 58.284271247 40 65 46.715728753 65 55 C 65 63.284271247 58.284271247 70 50 70 C 41.715728753 70 35 63.284271247 35 55 C 35 46.715728753 41.715728753 40 50 40 Z\" fill=\"#000000\" fill-rule=\"evenodd\"/><path d=\"M 20 20 C 25 35 30 35 30 35 C 30 35 25 15 35 25 C 25 15 15 5 20 20 Z M 80 20 C 85 5 75 15 65 25 C 75 15 70 35 70 35 C 70 35 75 35 80 20 Z M 25 90 C 35 85 40 78 40 75 C 40 75 25 80 30 75 C 20 85 10 95 25 90 Z M 75 90 C 90 95 80 85 70 75 C 75 80 60 75 60 75 C 60 78 65 85 75 90 Z\" fill=\"#000000\"/></g></svg>",
              "<svg xmlns=\"http://www.w3.org/2000/svg\" viewBox=\"0 0 100 100\"><g id=\"menu_kuramon\"><path d=\"M 50 15 C 75 15 85 35 85 55 C 85 75 70 85 50 85 C 30 85 15 75 15 55 C 15 35 25 15 50 15 Z M 50 40 C 58.284271247 40 65 46.715728753 65 55 C 65 63.284271247 58.284271247 70 50 70 C 41.715728753 70 35 63.284271247 35 55 C 35 46.715728753 41.715728753 40 50 40 Z\" fill=\"#000000\" fill-rule=\"evenodd\"/><path d=\"M 20 20 C 25 35 30 35 30 35 C 30 35 25 15 35 25 C 25 15 15 5 20 20 Z M 80 20 C 85 5 75 15 65 25 C 75 15 70 35 70 35 C 70 35 75 35 80 20 Z M 25 90 C 35 85 40 78 40 75 C 40 75 25 80 30 75 C 20 85 10 95 25 90 Z M 75 90 C 90 95 80 85 70 75 C 75 80 60 75 60 75 C 60 78 65 85 75 90 Z\" fill=\"#000000\"/></g></svg>",
              "<svg xmlns=\"http://www.w3.org/2000/svg\" viewBox=\"0 0 100 100\"><g id=\"menu_kuramon\"><path d=\"M 50 15 C 75 15 85 35 85 55 C 85 75 70 85 50 85 C 30 85 15 75 15 55 C 15 35 25 15 50 15 Z M 50 40 C 58.284271247 40 65 46.715728753 65 55 C 65 63.284271247 58.284271247 70 50 70 C 41.715728753 70 35 63.284271247 35 55 C 35 46.715728753 41.715728753 40 50 40 Z\" fill=\"#000000\" fill-rule=\"evenodd\"/><path d=\"M 20 20 C 25 35 30 35 30 35 C 30 35 25 15 35 25 C 25 15 15 5 20 20 Z M 80 20 C 85 5 75 15 65 25 C 75 15 70 35 70 35 C 70 35 75 35 80 20 Z M 25 90 C 35 85 40 78 40 75 C 40 75 25 80 30 75 C 20 85 10 95 25 90 Z M 75 90 C 90 95 80 85 70 75 C 75 80 60 75 60 75 C 60 78 65 85 75 90 Z\" fill=\"#000000\"/></g></svg>",
              "<svg xmlns=\"http://www.w3.org/2000/svg\" viewBox=\"0 0 100 100\"><g id=\"menu_kuramon\"><path d=\"M 50 15 C 75 15 85 35 85 55 C 85 75 70 85 50 85 C 30 85 15 75 15 55 C 15 35 25 15 50 15 Z M 50 40 C 58.284271247 40 65 46.715728753 65 55 C 65 63.284271247 58.284271247 70 50 70 C 41.715728753 70 35 63.284271247 35 55 C 35 46.715728753 41.715728753 40 50 40 Z\" fill=\"#000000\" fill-rule=\"evenodd\"/><path d=\"M 20 20 C 25 35 30 35 30 35 C 30 35 25 15 35 25 C 25 15 15 5 20 20 Z M 80 20 C 85 5 75 15 65 25 C 75 15 70 35 70 35 C 70 35 75 35 80 20 Z M 25 90 C 35 85 40 78 40 75 C 40 75 25 80 30 75 C 20 85 10 95 25 90 Z M 75 90 C 90 95 80 85 70 75 C 75 80 60 75 60 75 C 60 78 65 85 75 90 Z\" fill=\"#000000\"/></g></svg>",
              "<svg xmlns=\"http://www.w3.org/2000/svg\" viewBox=\"0 0 100 100\"><g id=\"menu_kuramon\"><path d=\"M 50 15 C 75 15 85 35 85 55 C 85 75 70 85 50 85 C 30 85 15 75 15 55 C 15 35 25 15 50 15 Z M 50 40 C 58.284271247 40 65 46.715728753 65 55 C 65 63.284271247 58.284271247 70 50 70 C 41.715728753 70 35 63.284271247 35 55 C 35 46.715728753 41.715728753 40 50 40 Z\" fill=\"#000000\" fill-rule=\"evenodd\"/><path d=\"M 20 20 C 25 35 30 35 30 35 C 30 35 25 15 35 25 C 25 15 15 5 20 20 Z M 80 20 C 85 5 75 15 65 25 C 75 15 70 35 70 35 C 70 35 75 35 80 20 Z M 25 90 C 35 85 40 78 40 75 C 40 75 25 80 30 75 C 20 85 10 95 25 90 Z M 75 90 C 90 95 80 85 70 75 C 75 80 60 75 60 75 C 60 78 65 85 75 90 Z\" fill=\"#000000\"/></g></svg>",